{
  "$schema": "https://json-schema.org/draft/2020-12/schema",
  "title": "features.json — playbook schema 1.0",
  "type": "array",
  "minItems": 1,
  "items": {
    "type": "object",
    "properties": {
      "schema_version": {
        "const": "1.0"
      },
      "cell_id": {
        "type": "string",
        "pattern": "^-?\\d+\\.\\d{2}_-?\\d+\\.\\d{2}$"
      },
      "ts": {
        "type": "string",
        "format": "date-time",
        "pattern": "^\\d{4}-\\d{2}-\\d{2}T\\d{2}:\\d{2}:\\d{2}(?:\\.\\d+)?Z$"
      },
      "lat": {
        "type": "number",
        "minimum": -90,
        "maximum": 90,
        "not": {
          "enum": [
            -999
          ]
        }
      },
      "lon": {
        "type": "number",
        "minimum": -180,
        "maximum": 180,
        "not": {
          "enum": [
            -999
          ]
        }
      },
      "peat": {
        "type": "object",
        "properties": {
          "peat_fraction": {
            "type": "number",
            "minimum": 0.05,
            "maximum": 1,
            "not": {
              "enum": [
                -999
              ]
            }
          },
          "peat_area_km2": {
            "type": [
              "number",
              "null"
            ],
            "minimum": 0,
            "not": {
              "enum": [
                -999
              ]
            }
          },
          "polygon_ids": {
            "type": "array",
            "items": {
              "type": "string",
              "minLength": 1
            }
          }
        },
        "required": [
          "peat_fraction",
          "peat_area_km2",
          "polygon_ids"
        ],
        "additionalProperties": false
      },
      "weather": {
        "type": "object",
        "properties": {
          "temp_c": {
            "type": [
              "number",
              "null"
            ],
            "not": {
              "enum": [
                -999
              ]
            }
          },
          "precip_mm": {
            "type": [
              "number",
              "null"
            ],
            "minimum": 0,
            "not": {
              "enum": [
                -999
              ]
            }
          },
          "wind_kmh": {
            "type": [
              "number",
              "null"
            ],
            "minimum": 0,
            "not": {
              "enum": [
                -999
              ]
            }
          },
          "wind_dir_deg": {
            "type": [
              "number",
              "null"
            ],
            "minimum": 0,
            "maximum": 360,
            "not": {
              "enum": [
                -999
              ]
            }
          },
          "sm_0_1": {
            "type": [
              "number",
              "null"
            ],
            "minimum": 0,
            "maximum": 1,
            "not": {
              "enum": [
                -999
              ]
            }
          },
          "sm_1_3": {
            "type": [
              "number",
              "null"
            ],
            "minimum": 0,
            "maximum": 1,
            "not": {
              "enum": [
                -999
              ]
            }
          },
          "sm_3_9": {
            "type": [
              "number",
              "null"
            ],
            "minimum": 0,
            "maximum": 1,
            "not": {
              "enum": [
                -999
              ]
            }
          },
          "sm_9_27": {
            "type": [
              "number",
              "null"
            ],
            "minimum": 0,
            "maximum": 1,
            "not": {
              "enum": [
                -999
              ]
            }
          },
          "sm_27_81": {
            "type": [
              "number",
              "null"
            ],
            "minimum": 0,
            "maximum": 1,
            "not": {
              "enum": [
                -999
              ]
            }
          },
          "vpd_kpa": {
            "type": [
              "number",
              "null"
            ],
            "minimum": 0,
            "not": {
              "enum": [
                -999
              ]
            }
          },
          "soil_temp_0_c": {
            "type": [
              "number",
              "null"
            ],
            "not": {
              "enum": [
                -999
              ]
            }
          },
          "soil_temp_18_c": {
            "type": [
              "number",
              "null"
            ],
            "not": {
              "enum": [
                -999
              ]
            }
          },
          "et_mm": {
            "type": [
              "number",
              "null"
            ],
            "minimum": 0,
            "not": {
              "enum": [
                -999
              ]
            }
          },
          "et0_mm": {
            "type": [
              "number",
              "null"
            ],
            "minimum": 0,
            "not": {
              "enum": [
                -999
              ]
            }
          }
        },
        "required": [
          "temp_c",
          "precip_mm",
          "wind_kmh",
          "wind_dir_deg",
          "sm_0_1",
          "sm_1_3",
          "sm_3_9",
          "sm_9_27",
          "sm_27_81",
          "vpd_kpa",
          "soil_temp_0_c",
          "soil_temp_18_c",
          "et_mm",
          "et0_mm"
        ],
        "additionalProperties": false
      },
      "derived": {
        "type": "object",
        "properties": {
          "rain_24h_mm": {
            "type": [
              "number",
              "null"
            ],
            "minimum": 0,
            "not": {
              "enum": [
                -999
              ]
            }
          },
          "rain_7d_mm": {
            "type": [
              "number",
              "null"
            ],
            "minimum": 0,
            "not": {
              "enum": [
                -999
              ]
            }
          },
          "rain_30d_mm": {
            "type": [
              "number",
              "null"
            ],
            "minimum": 0,
            "not": {
              "enum": [
                -999
              ]
            }
          },
          "days_since_rain": {
            "type": [
              "integer",
              "null"
            ],
            "minimum": 0,
            "not": {
              "enum": [
                -999
              ]
            }
          },
          "sm_27_81_delta_7d": {
            "type": [
              "number",
              "null"
            ],
            "not": {
              "enum": [
                -999
              ]
            }
          },
          "vpd_mean_24h": {
            "type": [
              "number",
              "null"
            ],
            "minimum": 0,
            "not": {
              "enum": [
                -999
              ]
            }
          },
          "soil_air_temp_gap_c": {
            "type": [
              "number",
              "null"
            ],
            "not": {
              "enum": [
                -999
              ]
            }
          }
        },
        "required": [
          "rain_24h_mm",
          "rain_7d_mm",
          "rain_30d_mm",
          "days_since_rain",
          "sm_27_81_delta_7d",
          "vpd_mean_24h",
          "soil_air_temp_gap_c"
        ],
        "additionalProperties": false
      },
      "fire": {
        "type": "object",
        "properties": {
          "hotspots_in_cell_24h": {
            "type": [
              "integer",
              "null"
            ],
            "minimum": 0,
            "not": {
              "enum": [
                -999
              ]
            }
          },
          "hotspots_10km_7d": {
            "type": [
              "integer",
              "null"
            ],
            "minimum": 0,
            "not": {
              "enum": [
                -999
              ]
            }
          },
          "frp_sum_10km_7d": {
            "type": [
              "number",
              "null"
            ],
            "minimum": 0,
            "not": {
              "enum": [
                -999
              ]
            }
          },
          "nearest_hotspot_km": {
            "type": [
              "number",
              "null"
            ],
            "minimum": 0,
            "not": {
              "enum": [
                -999
              ]
            }
          }
        },
        "required": [
          "hotspots_in_cell_24h",
          "hotspots_10km_7d",
          "frp_sum_10km_7d",
          "nearest_hotspot_km"
        ],
        "additionalProperties": false
      }
    },
    "required": [
      "schema_version",
      "cell_id",
      "ts",
      "lat",
      "lon",
      "peat",
      "weather",
      "derived",
      "fire"
    ],
    "additionalProperties": false
  }
}
