[
  {
    "schema_version": "1.0",
    "cell_id": "-1.85_116.35",
    "ts": "2026-10-16T00:00:00Z",
    "lat": -1.85,
    "lon": 116.35,
    "peat": {
      "peat_fraction": 0.0552676452712629,
      "peat_area_km2": 6.799481574404842,
      "polygon_ids": [
        "{923069FA-18BC-42EB-89F7-EABCB5D515EB}"
      ]
    },
    "weather": {
      "temp_c": 27.7,
      "precip_mm": 0.0,
      "wind_kmh": 10.8,
      "wind_dir_deg": 195.0,
      "sm_0_1": 0.123,
      "sm_1_3": 0.127,
      "sm_3_9": 0.139,
      "sm_9_27": 0.152,
      "sm_27_81": 0.169,
      "vpd_kpa": 0.67,
      "soil_temp_0_c": 30.2,
      "soil_temp_18_c": 28.3,
      "et_mm": 0.12,
      "et0_mm": 0.19
    },
    "derived": {
      "rain_24h_mm": 0.799999999999995,
      "rain_7d_mm": 1.2,
      "rain_30d_mm": 7.500000000000001,
      "days_since_rain": 21,
      "sm_27_81_delta_7d": 0.0020000000000000018,
      "vpd_mean_24h": 0.8724999999999999,
      "soil_air_temp_gap_c": 0.6000000000000014
    },
    "fire": {
      "hotspots_in_cell_24h": 1,
      "hotspots_10km_7d": null,
      "frp_sum_10km_7d": null,
      "nearest_hotspot_km": 3.7310287494478755
    }
  },
  {
    "schema_version": "1.0",
    "cell_id": "-2.95_110.75",
    "ts": "2026-10-16T00:00:00Z",
    "lat": -2.95,
    "lon": 110.75,
    "peat": {
      "peat_fraction": 0.44649843576046855,
      "peat_area_km2": 54.88891570663521,
      "polygon_ids": [
        "{2CD2BB34-98B8-4B23-AEFA-DE3C92D78546}",
        "{6C6651FA-1FFF-4546-9E19-60B0FC2C1626}"
      ]
    },
    "weather": {
      "temp_c": 27.3,
      "precip_mm": 0.0,
      "wind_kmh": 7.3,
      "wind_dir_deg": 70.0,
      "sm_0_1": 0.119,
      "sm_1_3": 0.123,
      "sm_3_9": 0.141,
      "sm_9_27": 0.156,
      "sm_27_81": 0.167,
      "vpd_kpa": 0.43,
      "soil_temp_0_c": 29.4,
      "soil_temp_18_c": 28.4,
      "et_mm": 0.06,
      "et0_mm": 0.11
    },
    "derived": {
      "rain_24h_mm": 0.0,
      "rain_7d_mm": 0.0,
      "rain_30d_mm": 0.1,
      "days_since_rain": 103,
      "sm_27_81_delta_7d": 0.0010000000000000009,
      "vpd_mean_24h": 0.9154166666666668,
      "soil_air_temp_gap_c": 1.0999999999999979
    },
    "fire": {
      "hotspots_in_cell_24h": 0,
      "hotspots_10km_7d": null,
      "frp_sum_10km_7d": null,
      "nearest_hotspot_km": 0.6050178648673569
    }
  },
  {
    "schema_version": "1.0",
    "cell_id": "-3.15_114.95",
    "ts": "2026-10-16T00:00:00Z",
    "lat": -3.15,
    "lon": 114.95,
    "peat": {
      "peat_fraction": 0.20441146150478798,
      "peat_area_km2": 25.1241475143948,
      "polygon_ids": [
        "{511C0596-9FDE-4166-8EC2-DD2F9A332BBA}"
      ]
    },
    "weather": {
      "temp_c": 28.7,
      "precip_mm": 0.0,
      "wind_kmh": 8.2,
      "wind_dir_deg": 142.0,
      "sm_0_1": 0.097,
      "sm_1_3": 0.105,
      "sm_3_9": 0.128,
      "sm_9_27": 0.15,
      "sm_27_81": 0.169,
      "vpd_kpa": 1.06,
      "soil_temp_0_c": 32.6,
      "soil_temp_18_c": 29.4,
      "et_mm": 0.11,
      "et0_mm": 0.22
    },
    "derived": {
      "rain_24h_mm": 0.4000000000000071,
      "rain_7d_mm": 0.40000000000000047,
      "rain_30d_mm": 14.200000000000005,
      "days_since_rain": 16,
      "sm_27_81_delta_7d": 0.006000000000000005,
      "vpd_mean_24h": 1.5079166666666666,
      "soil_air_temp_gap_c": 0.6999999999999993
    },
    "fire": {
      "hotspots_in_cell_24h": 0,
      "hotspots_10km_7d": 345,
      "frp_sum_10km_7d": 2014.710000000021,
      "nearest_hotspot_km": 1.4916823340270802
    }
  },
  {
    "schema_version": "1.0",
    "cell_id": "-3.45_111.85",
    "ts": "2026-10-16T00:00:00Z",
    "lat": -3.45,
    "lon": 111.85,
    "peat": {
      "peat_fraction": 0.5438343423614259,
      "peat_area_km2": 66.82286682527197,
      "polygon_ids": [
        "{D84EFC61-790F-4046-BC46-8E9BB48CC4D3}"
      ]
    },
    "weather": {
      "temp_c": 28.4,
      "precip_mm": 0.0,
      "wind_kmh": 19.4,
      "wind_dir_deg": 121.0,
      "sm_0_1": 0.043,
      "sm_1_3": 0.074,
      "sm_3_9": 0.12,
      "sm_9_27": 0.136,
      "sm_27_81": 0.147,
      "vpd_kpa": 0.89,
      "soil_temp_0_c": 29.9,
      "soil_temp_18_c": 28.9,
      "et_mm": 0.12,
      "et0_mm": 0.18
    },
    "derived": {
      "rain_24h_mm": 0.0,
      "rain_7d_mm": 0.0,
      "rain_30d_mm": 0.19999999999999957,
      "days_since_rain": 110,
      "sm_27_81_delta_7d": 0.0069999999999999785,
      "vpd_mean_24h": 1.0404166666666665,
      "soil_air_temp_gap_c": 0.5
    },
    "fire": {
      "hotspots_in_cell_24h": 2,
      "hotspots_10km_7d": null,
      "frp_sum_10km_7d": null,
      "nearest_hotspot_km": 0.13779902129618488
    }
  },
  {
    "schema_version": "1.0",
    "cell_id": "3.45_117.05",
    "ts": "2026-10-16T00:00:00Z",
    "lat": 3.45,
    "lon": 117.05,
    "peat": {
      "peat_fraction": 0.0906713988796984,
      "peat_area_km2": 11.141118424924793,
      "polygon_ids": [
        "{19AC9135-F73F-46DB-8435-51D48CAD2F07}",
        "{CAE8AC77-4C8A-4603-A3B8-0B7E6EAB8FB9}"
      ]
    },
    "weather": {
      "temp_c": 27.9,
      "precip_mm": 0.2,
      "wind_kmh": 4.4,
      "wind_dir_deg": 171.0,
      "sm_0_1": 0.302,
      "sm_1_3": 0.298,
      "sm_3_9": 0.3,
      "sm_9_27": 0.32,
      "sm_27_81": 0.316,
      "vpd_kpa": 0.41,
      "soil_temp_0_c": 29.7,
      "soil_temp_18_c": 28.1,
      "et_mm": 0.15,
      "et0_mm": 0.16
    },
    "derived": {
      "rain_24h_mm": 0.20000000000000379,
      "rain_7d_mm": 30.999999999999996,
      "rain_30d_mm": 154.6,
      "days_since_rain": 5,
      "sm_27_81_delta_7d": -0.0050000000000000044,
      "vpd_mean_24h": 0.9670833333333332,
      "soil_air_temp_gap_c": 0.20000000000000284
    },
    "fire": {
      "hotspots_in_cell_24h": 0,
      "hotspots_10km_7d": 5,
      "frp_sum_10km_7d": 42.129999999999995,
      "nearest_hotspot_km": 7.483700773400601
    }
  }
]
