[
  {
    "schema_version": "1.0",
    "cell_id": "-3.35_113.75",
    "lat": -3.35,
    "lon": 113.75,
    "peat": {
      "peat_fraction": 0.3908851996638104,
      "peat_area_km2": 48.034313388130414,
      "polygon_ids": [
        "{99D273D9-1488-423C-A4EF-FD7176DF6939}"
      ]
    },
    "ts": "2026-10-16T23:00:00Z",
    "weather": {
      "temp_c": 27.6,
      "precip_mm": 0.0,
      "wind_kmh": 14.3,
      "wind_dir_deg": 126.0,
      "sm_0_1": 0.074,
      "sm_1_3": 0.074,
      "sm_3_9": 0.074,
      "sm_9_27": 0.056,
      "sm_27_81": 0.058,
      "vpd_kpa": 0.81,
      "soil_temp_0_c": 27.6,
      "soil_temp_18_c": 30.3,
      "et_mm": 0.02,
      "et0_mm": 0.07
    },
    "derived": {
      "rain_24h_mm": 1.9,
      "rain_7d_mm": 20.7,
      "rain_30d_mm": 60.8,
      "days_since_rain": 0,
      "sm_27_81_delta_7d": 0.0010000000000000009,
      "vpd_mean_24h": 1.2033333333333334,
      "soil_air_temp_gap_c": null
    },
    "fire": {
      "hotspots_in_cell_24h": null,
      "hotspots_10km_7d": null,
      "frp_sum_10km_7d": null,
      "nearest_hotspot_km": null
    }
  },
  {
    "schema_version": "1.0",
    "cell_id": "-3.05_115.05",
    "lat": -3.05,
    "lon": 115.05,
    "peat": {
      "peat_fraction": 0.4082384118936025,
      "peat_area_km2": 50.18107571703417,
      "polygon_ids": [
        "{511C0596-9FDE-4166-8EC2-DD2F9A332BBA}"
      ]
    },
    "ts": "2026-10-16T23:00:00Z",
    "weather": {
      "temp_c": 26.3,
      "precip_mm": 0.0,
      "wind_kmh": 7.5,
      "wind_dir_deg": 130.0,
      "sm_0_1": 0.34,
      "sm_1_3": 0.34,
      "sm_3_9": 0.34,
      "sm_9_27": 0.337,
      "sm_27_81": 0.363,
      "vpd_kpa": 0.61,
      "soil_temp_0_c": 27.1,
      "soil_temp_18_c": 32.2,
      "et_mm": 0.01,
      "et0_mm": 0.05
    },
    "derived": {
      "rain_24h_mm": 0.4,
      "rain_7d_mm": 3.0,
      "rain_30d_mm": 20.5,
      "days_since_rain": 15,
      "sm_27_81_delta_7d": 0.025999999999999968,
      "vpd_mean_24h": 1.8433333333333335,
      "soil_air_temp_gap_c": null
    },
    "fire": {
      "hotspots_in_cell_24h": null,
      "hotspots_10km_7d": null,
      "frp_sum_10km_7d": null,
      "nearest_hotspot_km": null
    }
  },
  {
    "schema_version": "1.0",
    "cell_id": "-2.75_113.35",
    "lat": -2.75,
    "lon": 113.35,
    "peat": {
      "peat_fraction": 0.8708699963951315,
      "peat_area_km2": 107.07585397276743,
      "polygon_ids": [
        "{99D273D9-1488-423C-A4EF-FD7176DF6939}"
      ]
    },
    "ts": "2026-10-16T23:00:00Z",
    "weather": {
      "temp_c": 25.1,
      "precip_mm": 0.0,
      "wind_kmh": 7.7,
      "wind_dir_deg": 111.0,
      "sm_0_1": 0.163,
      "sm_1_3": 0.163,
      "sm_3_9": 0.163,
      "sm_9_27": 0.165,
      "sm_27_81": 0.191,
      "vpd_kpa": 0.3,
      "soil_temp_0_c": 25.1,
      "soil_temp_18_c": 28.7,
      "et_mm": 0.02,
      "et0_mm": 0.03
    },
    "derived": {
      "rain_24h_mm": 3.9,
      "rain_7d_mm": 13.9,
      "rain_30d_mm": 63.2,
      "days_since_rain": 0,
      "sm_27_81_delta_7d": -0.009000000000000008,
      "vpd_mean_24h": 0.8416666666666667,
      "soil_air_temp_gap_c": null
    },
    "fire": {
      "hotspots_in_cell_24h": null,
      "hotspots_10km_7d": null,
      "frp_sum_10km_7d": null,
      "nearest_hotspot_km": null
    }
  },
  {
    "schema_version": "1.0",
    "cell_id": "-2.55_113.05",
    "lat": -2.55,
    "lon": 113.05,
    "peat": {
      "peat_fraction": 0.8808642820971799,
      "peat_area_km2": 108.32171057451998,
      "polygon_ids": [
        "{F58D36CF-BF6B-43D4-8EE8-DB89CFCA005B}"
      ]
    },
    "ts": "2026-10-16T23:00:00Z",
    "weather": {
      "temp_c": 24.8,
      "precip_mm": 0.0,
      "wind_kmh": 5.3,
      "wind_dir_deg": 62.0,
      "sm_0_1": 0.314,
      "sm_1_3": 0.314,
      "sm_3_9": 0.314,
      "sm_9_27": 0.277,
      "sm_27_81": 0.304,
      "vpd_kpa": 0.16,
      "soil_temp_0_c": 24.9,
      "soil_temp_18_c": 28.1,
      "et_mm": 0.01,
      "et0_mm": 0.02
    },
    "derived": {
      "rain_24h_mm": 2.6,
      "rain_7d_mm": 15.5,
      "rain_30d_mm": 67.6,
      "days_since_rain": 0,
      "sm_27_81_delta_7d": 0.0010000000000000009,
      "vpd_mean_24h": 0.7391666666666666,
      "soil_air_temp_gap_c": null
    },
    "fire": {
      "hotspots_in_cell_24h": null,
      "hotspots_10km_7d": null,
      "frp_sum_10km_7d": null,
      "nearest_hotspot_km": null
    }
  },
  {
    "schema_version": "1.0",
    "cell_id": "-2.45_114.45",
    "lat": -2.45,
    "lon": 114.45,
    "peat": {
      "peat_fraction": 0.6673100079082716,
      "peat_area_km2": 82.06658419582782,
      "polygon_ids": [
        "{917EA050-5134-4BDC-9B40-D6F63478B581}",
        "{B8766416-8658-45A7-AA6E-7C8076A700D9}"
      ]
    },
    "ts": "2026-10-16T23:00:00Z",
    "weather": {
      "temp_c": 25.5,
      "precip_mm": 0.0,
      "wind_kmh": 3.6,
      "wind_dir_deg": 147.0,
      "sm_0_1": 0.372,
      "sm_1_3": 0.372,
      "sm_3_9": 0.372,
      "sm_9_27": 0.304,
      "sm_27_81": 0.304,
      "vpd_kpa": 0.35,
      "soil_temp_0_c": 26.0,
      "soil_temp_18_c": 29.4,
      "et_mm": 0.03,
      "et0_mm": 0.03
    },
    "derived": {
      "rain_24h_mm": 2.4,
      "rain_7d_mm": 12.8,
      "rain_30d_mm": 50.8,
      "days_since_rain": 0,
      "sm_27_81_delta_7d": -0.0010000000000000009,
      "vpd_mean_24h": 0.93125,
      "soil_air_temp_gap_c": null
    },
    "fire": {
      "hotspots_in_cell_24h": null,
      "hotspots_10km_7d": null,
      "frp_sum_10km_7d": null,
      "nearest_hotspot_km": null
    }
  },
  {
    "schema_version": "1.0",
    "cell_id": "-2.25_113.15",
    "lat": -2.25,
    "lon": 113.15,
    "peat": {
      "peat_fraction": 0.7305223845423824,
      "peat_area_km2": 89.85304454683853,
      "polygon_ids": [
        "{F58D36CF-BF6B-43D4-8EE8-DB89CFCA005B}"
      ]
    },
    "ts": "2026-10-16T23:00:00Z",
    "weather": {
      "temp_c": 24.8,
      "precip_mm": 0.0,
      "wind_kmh": 4.6,
      "wind_dir_deg": 69.0,
      "sm_0_1": 0.345,
      "sm_1_3": 0.345,
      "sm_3_9": 0.345,
      "sm_9_27": 0.287,
      "sm_27_81": 0.293,
      "vpd_kpa": 0.19,
      "soil_temp_0_c": 24.9,
      "soil_temp_18_c": 28.6,
      "et_mm": 0.01,
      "et0_mm": 0.02
    },
    "derived": {
      "rain_24h_mm": 3.3,
      "rain_7d_mm": 13.6,
      "rain_30d_mm": 91.6,
      "days_since_rain": 0,
      "sm_27_81_delta_7d": 0.01699999999999996,
      "vpd_mean_24h": 0.6404166666666667,
      "soil_air_temp_gap_c": null
    },
    "fire": {
      "hotspots_in_cell_24h": null,
      "hotspots_10km_7d": null,
      "frp_sum_10km_7d": null,
      "nearest_hotspot_km": null
    }
  },
  {
    "schema_version": "1.0",
    "cell_id": "-2.15_114.55",
    "lat": -2.15,
    "lon": 114.55,
    "peat": {
      "peat_fraction": 1.0,
      "peat_area_km2": 123.00637200569771,
      "polygon_ids": [
        "{917EA050-5134-4BDC-9B40-D6F63478B581}"
      ]
    },
    "ts": "2026-10-16T23:00:00Z",
    "weather": {
      "temp_c": 24.6,
      "precip_mm": 0.0,
      "wind_kmh": 2.5,
      "wind_dir_deg": 4.0,
      "sm_0_1": 0.325,
      "sm_1_3": 0.325,
      "sm_3_9": 0.325,
      "sm_9_27": 0.295,
      "sm_27_81": 0.31,
      "vpd_kpa": 0.16,
      "soil_temp_0_c": 25.0,
      "soil_temp_18_c": 29.1,
      "et_mm": 0.03,
      "et0_mm": 0.03
    },
    "derived": {
      "rain_24h_mm": 1.9,
      "rain_7d_mm": 18.1,
      "rain_30d_mm": 96.1,
      "days_since_rain": 0,
      "sm_27_81_delta_7d": 0.009000000000000008,
      "vpd_mean_24h": 0.8183333333333334,
      "soil_air_temp_gap_c": null
    },
    "fire": {
      "hotspots_in_cell_24h": null,
      "hotspots_10km_7d": null,
      "frp_sum_10km_7d": null,
      "nearest_hotspot_km": null
    }
  },
  {
    "schema_version": "1.0",
    "cell_id": "-1.85_113.75",
    "lat": -1.85,
    "lon": 113.75,
    "peat": {
      "peat_fraction": 0.2396040409417198,
      "peat_area_km2": 29.478069096085804,
      "polygon_ids": [
        "{7D42D9C0-8D08-4E2E-A8D8-B7F1F99C7B68}",
        "{C92F7F76-EE99-46CF-AD7B-E6592B426B60}"
      ]
    },
    "ts": "2026-10-16T23:00:00Z",
    "weather": {
      "temp_c": 23.7,
      "precip_mm": 0.0,
      "wind_kmh": 6.2,
      "wind_dir_deg": 350.0,
      "sm_0_1": 0.208,
      "sm_1_3": 0.208,
      "sm_3_9": 0.208,
      "sm_9_27": 0.175,
      "sm_27_81": 0.15,
      "vpd_kpa": 0.04,
      "soil_temp_0_c": 23.8,
      "soil_temp_18_c": 27.4,
      "et_mm": 0.01,
      "et0_mm": 0.02
    },
    "derived": {
      "rain_24h_mm": 5.5,
      "rain_7d_mm": 22.2,
      "rain_30d_mm": 101.8,
      "days_since_rain": 0,
      "sm_27_81_delta_7d": -0.0050000000000000044,
      "vpd_mean_24h": 0.5879166666666666,
      "soil_air_temp_gap_c": null
    },
    "fire": {
      "hotspots_in_cell_24h": null,
      "hotspots_10km_7d": null,
      "frp_sum_10km_7d": null,
      "nearest_hotspot_km": null
    }
  },
  {
    "schema_version": "1.0",
    "cell_id": "-1.45_114.85",
    "lat": -1.45,
    "lon": 114.85,
    "peat": {
      "peat_fraction": 0.25339621046913463,
      "peat_area_km2": 31.18099801586079,
      "polygon_ids": [
        "{22D9D9CF-CEBF-4CFA-940B-15DF0C611987}"
      ]
    },
    "ts": "2026-10-16T23:00:00Z",
    "weather": {
      "temp_c": 23.8,
      "precip_mm": 0.0,
      "wind_kmh": 6.1,
      "wind_dir_deg": 320.0,
      "sm_0_1": 0.424,
      "sm_1_3": 0.424,
      "sm_3_9": 0.424,
      "sm_9_27": 0.388,
      "sm_27_81": 0.372,
      "vpd_kpa": 0.06,
      "soil_temp_0_c": 23.9,
      "soil_temp_18_c": 28.2,
      "et_mm": 0.04,
      "et0_mm": 0.03
    },
    "derived": {
      "rain_24h_mm": 4.5,
      "rain_7d_mm": 15.9,
      "rain_30d_mm": 88.6,
      "days_since_rain": 0,
      "sm_27_81_delta_7d": 0.0,
      "vpd_mean_24h": 0.78875,
      "soil_air_temp_gap_c": null
    },
    "fire": {
      "hotspots_in_cell_24h": null,
      "hotspots_10km_7d": null,
      "frp_sum_10km_7d": null,
      "nearest_hotspot_km": null
    }
  }
]
